{
  "schema_version": "1.1",
  "stage": "deploy",
  "timestamp": "2026-05-28T08:56:27+0000",
  "rc": 0,
  "status": "success",
  "runner": {
    "platform": "gitlab",
    "image": "ghcr.io/getbrik/brik-runner-node:22",
    "job_url": "http://gitlab.briklab.test:8929/brik/node-deploy-k8s/-/jobs/36095"
  },
  "tech": {
    "environments": [
      "staging"
    ],
    "duration_ms": "171",
    "exit_code": "0",
    "status": "success"
  },
  "business": {
    "environments": [
      {
        "name": "staging",
        "target": "k8s",
        "namespace": "brik-e2e-k8s"
      }
    ],
    "status": "success",
    "reason": ""
  },
  "duration_ms": 171
}
