{
  "schema_version": "1.1",
  "stage": "deploy",
  "timestamp": "2026-05-28T09:04:30+0000",
  "rc": 1,
  "status": "failed",
  "runner": {
    "platform": "gitlab",
    "image": "ghcr.io/getbrik/brik-runner-node:22",
    "job_url": "http://gitlab.briklab.test:8929/brik/node-deploy-gitops/-/jobs/36121"
  },
  "tech": {
    "environments": [
      "staging"
    ],
    "duration_ms": "300580",
    "exit_code": "1",
    "status": "failed"
  },
  "business": {
    "environments": [
      {
        "name": "staging",
        "target": "gitops",
        "namespace": null
      }
    ],
    "status": "error",
    "reason": "failure (fix available, not applied)"
  },
  "duration_ms": 300580
}
